{
  "slug": "norac-koleksiyonu",
  "name": "Norac",
  "title": "Doğadan, evine.",
  "description": "Ahşabın dokusu ve yalın formlar. Norac, yatak odasından yaşam alanına uzanan bir bütünlük kurar.",
  "seo": {
    "title": "Norac Koleksiyonu | Normod Kıbrıs",
    "description": "Ahşabın dokusu ve yalın formlar. Norac, yatak odasından yaşam alanına uzanan bir bütünlük kurar."
  }
}
