{
  "slug": "carle-koleksiyonu",
  "name": "Carle",
  "title": "Rahatlığın yeni formu.",
  "description": "Yumuşak hatlar ve yere yakın bir silüet. Carle, birlikte geçirilen anlara sakin bir alan açar.",
  "seo": {
    "title": "Carle Koleksiyonu | Normod Kıbrıs",
    "description": "Yumuşak hatlar ve yere yakın bir silüet. Carle, birlikte geçirilen anlara sakin bir alan açar."
  }
}
