{
  "slug": "klem-collection",
  "name": "Klem",
  "title": "Room to change.",
  "description": "Clean lines, wooden legs and room for different arrangements. Find your own way of living with Klem.",
  "seo": {
    "title": "Klem Collection | Normod Cyprus",
    "description": "Clean lines, wooden legs and room for different arrangements. Find your own way of living with Klem."
  }
}
