{
  "slug": "carle-collection",
  "name": "Carle",
  "title": "A softer way to live.",
  "description": "Soft contours and a low silhouette. Carle makes a calm space for time spent together.",
  "seo": {
    "title": "Carle Collection | Normod Cyprus",
    "description": "Soft contours and a low silhouette. Carle makes a calm space for time spent together."
  }
}
