{
  "slug": "klem-koleksiyonu",
  "name": "Klem",
  "title": "Değişime açık.",
  "description": "İnce çizgiler, ahşap ayaklar ve farklı yerleşimlere açılan bir tasarım. Klem ile yaşam alanının kendi düzenini bul.",
  "seo": {
    "title": "Klem Koleksiyonu | Normod Kıbrıs",
    "description": "İnce çizgiler, ahşap ayaklar ve farklı yerleşimlere açılan bir tasarım. Klem ile yaşam alanının kendi düzenini bul."
  }
}
