{
  "slug": "norac-collection",
  "name": "Norac",
  "title": "From nature, to home.",
  "description": "The texture of wood and simple forms. Norac brings a sense of continuity from the bedroom to the living room.",
  "seo": {
    "title": "Norac Collection | Normod Cyprus",
    "description": "The texture of wood and simple forms. Norac brings a sense of continuity from the bedroom to the living room."
  }
}
